{
  "apiVersion": "trust.forms.takoform.com/v1",
  "kind": "FormPackageRevocation",
  "sequence": 1,
  "statementVersion": "1.0.0",
  "packageDigest": "sha256:aaaaaaaaaaaaaaaaaaaaaaaaaaaaaaaaaaaaaaaaaaaaaaaaaaaaaaaaaaaaaaaa",
  "formRef": {
    "apiVersion": "storage.forms.publisher.example",
    "kind": "ObjectBucket",
    "definitionVersion": "0.1.0",
    "schemaDigest": "sha256:cccccccccccccccccccccccccccccccccccccccccccccccccccccccccccccccc"
  },
  "reasonCode": "signature-invalid",
  "summary": "The retained signature cannot be validated.",
  "issuedAt": "2026-08-28T00:00:00Z",
  "effects": {
    "blockNewCreateOrUpdate": true,
    "blockActivation": true,
    "retainBytesForObserveAndDelete": true
  }
}
